id,content_type,category_id,category_name,grade_id,grade_name,item,description
CCSS.MATH.CONTENT.3.OA.A.4,MATH.CONTENT,OA,Operations & Algebraic Thinking,3,Grade 3,A4,"Determine the unknown whole number in a multiplication or division equation relating three whole numbers. For example, determine the unknown number that makes the equation true in each of the equations 8 _ ? = 48, 5 = _ Ö 3, 6 _ 6 = ?"
CCSS.MATH.CONTENT.3.OA.B.5,MATH.CONTENT,OA,Operations & Algebraic Thinking,3,Grade 3,B5,"Apply properties of operations as strategies to multiply and divide.2 Examples: If 6 _ 4 = 24 is known, then 4 _ 6 = 24 is also known. (Commutative property of multiplication.) 3 _ 5 _ 2 can be found by 3 _ 5 = 15, then 15 _ 2 = 30, or by 5 _ 2 = 10, then 3 _ 10 = 30. (Associative property of multiplication.) Knowing that 8 _ 5 = 40 and 8 _ 2 = 16, one can find 8 _ 7 as 8 _ (5 + 2) = (8 _ 5) + (8 _ 2) = 40 + 16 = 56. (Distributive property.)"
CCSS.MATH.CONTENT.3.OA.B.6,MATH.CONTENT,OA,Operations & Algebraic Thinking,3,Grade 3,B6,"Understand division as an unknown-factor problem. For example, find 32 Ö 8 by finding the number that makes 32 when multiplied by 8."
CCSS.MATH.CONTENT.3.OA.C.7,MATH.CONTENT,OA,Operations & Algebraic Thinking,3,Grade 3,C7,"Fluently multiply and divide within 100, using strategies such as the relationship between multiplication and division (e.g., knowing that 8 _ 5 = 40, one knows 40 Ö 5 = 8) or properties of operations. By the end of Grade 3, know from memory all products of two one-digit numbers."
CCSS.MATH.CONTENT.3.OA.D.8,MATH.CONTENT,OA,Operations & Algebraic Thinking,3,Grade 3,D8,Solve two-step word problems using the four operations. Represent these problems using equations with a letter standing for the unknown quantity. Assess the reasonableness of answers using mental computation and estimation strategies including rounding.3
CCSS.MATH.CONTENT.3.OA.D.9,MATH.CONTENT,OA,Operations & Algebraic Thinking,3,Grade 3,D9,"Identify arithmetic patterns (including patterns in the addition table or multiplication table), and explain them using properties of operations. For example, observe that 4 times a number is always even, and explain why 4 times a number can be decomposed into two equal addends."
CCSS.MATH.CONTENT.4.G.A.1,MATH.CONTENT,G,Geometry,4,Grade 4,A1,"Draw points, lines, line segments, rays, angles (right, acute, obtuse), and perpendicular and parallel lines. Identify these in two-dimensional figures."
CCSS.MATH.CONTENT.4.G.A.2,MATH.CONTENT,G,Geometry,4,Grade 4,A2,"Classify two-dimensional figures based on the presence or absence of parallel or perpendicular lines, or the presence or absence of angles of a specified size. Recognize right triangles as a category, and identify right triangles."
CCSS.MATH.CONTENT.4.G.A.3,MATH.CONTENT,G,Geometry,4,Grade 4,A3,Recognize a line of symmetry for a two-dimensional figure as a line across the figure such that the figure can be folded along the line into matching parts. Identify line-symmetric figures and draw lines of symmetry.
CCSS.MATH.CONTENT.4.MD.A.1,MATH.CONTENT,MD,Measurement & Data,4,Grade 4,A1,"Know relative sizes of measurement units within one system of units including km, m, cm; kg, g; lb, oz.; l, ml; hr, min, sec. Within a single system of measurement, express measurements in a larger unit in terms of a smaller unit. Record measurement equivalents in a two-column table. For example, know that 1 ft is 12 times as long as 1 in. Express the length of a 4 ft snake as 48 in. Generate a conversion table for feet and inches listing the number pairs (1, 12), (2, 24), (3, 36), ..."
CCSS.MATH.CONTENT.4.MD.A.2,MATH.CONTENT,MD,Measurement & Data,4,Grade 4,A2,"Use the four operations to solve word problems involving distances, intervals of time, liquid volumes, masses of objects, and money, including problems involving simple fractions or decimals, and problems that require expressing measurements given in a larger unit in terms of a smaller unit. Represent measurement quantities using diagrams such as number line diagrams that feature a measurement scale."
CCSS.MATH.CONTENT.4.MD.A.3,MATH.CONTENT,MD,Measurement & Data,4,Grade 4,A3,"Apply the area and perimeter formulas for rectangles in real world and mathematical problems. For example, find the width of a rectangular room given the area of the flooring and the length, by viewing the area formula as a multiplication equation with an unknown factor."
CCSS.MATH.CONTENT.4.MD.B.4,MATH.CONTENT,MD,Measurement & Data,4,Grade 4,B4,"Make a line plot to display a data set of measurements in fractions of a unit (1/2, 1/4, 1/8). Solve problems involving addition and subtraction of fractions by using information presented in line plots. For example, from a line plot find and interpret the difference in length between the longest and shortest specimens in an insect collection."
CCSS.MATH.CONTENT.4.MD.C.5,MATH.CONTENT,MD,Measurement & Data,4,Grade 4,C5,"Recognize angles as geometric shapes that are formed wherever two rays share a common endpoint, and understand concepts of angle measurement:"
CCSS.MATH.CONTENT.4.MD.C.5.a,MATH.CONTENT,MD,Measurement & Data,4,Grade 4,C5a,"An angle is measured with reference to a circle with its center at the common endpoint of the rays, by considering the fraction of the circular arc between the points where the two rays intersect the circle. An angle that turns through 1/360 of a circle is called a ""one-degree angle,"" and can be used to measure angles."
CCSS.MATH.CONTENT.4.MD.C.5.b,MATH.CONTENT,MD,Measurement & Data,4,Grade 4,C5b,An angle that turns through n one-degree angles is said to have an angle measure of n degrees.
CCSS.MATH.CONTENT.4.MD.C.6,MATH.CONTENT,MD,Measurement & Data,4,Grade 4,C6,Measure angles in whole-number degrees using a protractor. Sketch angles of specified measure.
CCSS.MATH.CONTENT.4.MD.C.7,MATH.CONTENT,MD,Measurement & Data,4,Grade 4,C7,"Recognize angle measure as additive. When an angle is decomposed into non-overlapping parts, the angle measure of the whole is the sum of the angle measures of the parts. Solve addition and subtraction problems to find unknown angles on a diagram in real world and mathematical problems, e.g., by using an equation with a symbol for the unknown angle measure."
CCSS.MATH.CONTENT.4.NBT.A.1,MATH.CONTENT,NBT,Number & Operations in Base Ten,4,Grade 4,A1,"Recognize that in a multi-digit whole number, a digit in one place represents ten times what it represents in the place to its right. For example, recognize that 700 ÷ 70 = 10 by applying concepts of place value and division."
CCSS.MATH.CONTENT.4.NBT.A.2,MATH.CONTENT,NBT,Number & Operations in Base Ten,4,Grade 4,A2,"Read and write multi-digit whole numbers using base-ten numerals, number names, and expanded form. Compare two multi-digit numbers based on meanings of the digits in each place, using >, =, and < symbols to record the results of comparisons."
CCSS.MATH.CONTENT.4.NBT.A.3,MATH.CONTENT,NBT,Number & Operations in Base Ten,4,Grade 4,A3,Use place value understanding to round multi-digit whole numbers to any place.
CCSS.MATH.CONTENT.4.NBT.B.4,MATH.CONTENT,NBT,Number & Operations in Base Ten,4,Grade 4,B4,Fluently add and subtract multi-digit whole numbers using the standard algorithm.
CCSS.MATH.CONTENT.4.NBT.B.5,MATH.CONTENT,NBT,Number & Operations in Base Ten,4,Grade 4,B5,"Multiply a whole number of up to four digits by a one-digit whole number, and multiply two two-digit numbers, using strategies based on place value and the properties of operations. Illustrate and explain the calculation by using equations, rectangular arrays, and/or area models."
CCSS.MATH.CONTENT.4.NBT.B.6,MATH.CONTENT,NBT,Number & Operations in Base Ten,4,Grade 4,B6,"Find whole-number quotients and remainders with up to four-digit dividends and one-digit divisors, using strategies based on place value, the properties of operations, and/or the relationship between multiplication and division. Illustrate and explain the calculation by using equations, rectangular arrays, and/or area models."
CCSS.MATH.CONTENT.4.NF.A.1,MATH.CONTENT,NF,Numbers & Operations - Fractions,4,Grade 4,A1,"Explain why a fraction a/b is equivalent to a fraction (n × a)/(n × b) by using visual fraction models, with attention to how the number and size of the parts differ even though the two fractions themselves are the same size. Use this principle to recognize and generate equivalent fractions."
CCSS.MATH.CONTENT.4.NF.A.2,MATH.CONTENT,NF,Numbers & Operations - Fractions,4,Grade 4,A2,"Compare two fractions with different numerators and different denominators, e.g., by creating common denominators or numerators, or by comparing to a benchmark fraction such as 1/2. Recognize that comparisons are valid only when the two fractions refer to the same whole. Record the results of comparisons with symbols >, =, or <, and justify the conclusions, e.g., by using a visual fraction model."
CCSS.MATH.CONTENT.4.NF.B.3,MATH.CONTENT,NF,Numbers & Operations - Fractions,4,Grade 4,B3,Understand a fraction a/b with a > 1 as a sum of fractions 1/b.
CCSS.MATH.CONTENT.4.NF.B.3.a,MATH.CONTENT,NF,Numbers & Operations - Fractions,4,Grade 4,B3a,Understand addition and subtraction of fractions as joining and separating parts referring to the same whole.
CCSS.MATH.CONTENT.4.NF.B.3.b,MATH.CONTENT,NF,Numbers & Operations - Fractions,4,Grade 4,B3b,"Decompose a fraction into a sum of fractions with the same denominator in more than one way, recording each decomposition by an equation. Justify decompositions, e.g., by using a visual fraction model. Examples: 3/8 = 1/8 + 1/8 + 1/8 ; 3/8 = 1/8 + 2/8 ; 2 1/8 = 1 + 1 + 1/8 = 8/8 + 8/8 + 1/8."
CCSS.MATH.CONTENT.4.NF.B.3.c,MATH.CONTENT,NF,Numbers & Operations - Fractions,4,Grade 4,B3c,"Add and subtract mixed numbers with like denominators, e.g., by replacing each mixed number with an equivalent fraction, and/or by using properties of operations and the relationship between addition and subtraction."
CCSS.MATH.CONTENT.4.NF.B.3.d,MATH.CONTENT,NF,Numbers & Operations - Fractions,4,Grade 4,B3d,"Solve word problems involving addition and subtraction of fractions referring to the same whole and having like denominators, e.g., by using visual fraction models and equations to represent the problem."
CCSS.MATH.CONTENT.4.NF.B.4,MATH.CONTENT,NF,Numbers & Operations - Fractions,4,Grade 4,B4,Apply and extend previous understandings of multiplication to multiply a fraction by a whole number.
CCSS.MATH.CONTENT.4.NF.B.4.a,MATH.CONTENT,NF,Numbers & Operations - Fractions,4,Grade 4,B4a,"Understand a fraction a/b as a multiple of 1/b. For example, use a visual fraction model to represent 5/4 as the product 5 × (1/4), recording the conclusion by the equation 5/4 = 5 × (1/4)."
CCSS.MATH.CONTENT.4.NF.B.4.b,MATH.CONTENT,NF,Numbers & Operations - Fractions,4,Grade 4,B4b,"Understand a multiple of a/b as a multiple of 1/b, and use this understanding to multiply a fraction by a whole number. For example, use a visual fraction model to express 3 × (2/5) as 6 × (1/5), recognizing this product as 6/5. (In general, n × (a/b) = (n × a)/b.)"
CCSS.MATH.CONTENT.4.NF.B.4.c,MATH.CONTENT,NF,Numbers & Operations - Fractions,4,Grade 4,B4c,"Solve word problems involving multiplication of a fraction by a whole number, e.g., by using visual fraction models and equations to represent the problem. For example, if each person at a party will eat 3/8 of a pound of roast beef, and there will be 5 people at the party, how many pounds of roast beef will be needed? Between what two whole numbers does your answer lie?"
CCSS.MATH.CONTENT.4.NF.C.5,MATH.CONTENT,NF,Numbers & Operations - Fractions,4,Grade 4,C5,"Express a fraction with denominator 10 as an equivalent fraction with denominator 100, and use this technique to add two fractions with respective denominators 10 and 100.2 For example, express 3/10 as 30/100, and add 3/10 + 4/100 = 34/100."
CCSS.MATH.CONTENT.4.NF.C.6,MATH.CONTENT,NF,Numbers & Operations - Fractions,4,Grade 4,C6,"Use decimal notation for fractions with denominators 10 or 100. For example, rewrite 0.62 as 62/100; describe a length as 0.62 meters; locate 0.62 on a number line diagram."
CCSS.MATH.CONTENT.4.NF.C.7,MATH.CONTENT,NF,Numbers & Operations - Fractions,4,Grade 4,C7,"Compare two decimals to hundredths by reasoning about their size. Recognize that comparisons are valid only when the two decimals refer to the same whole. Record the results of comparisons with the symbols >, =, or <, and justify the conclusions, e.g., by using a visual model."
CCSS.MATH.CONTENT.4.OA.A.1,MATH.CONTENT,OA,Operations & Algebraic Thinking,4,Grade 4,A1,"Interpret a multiplication equation as a comparison, e.g., interpret 35 = 5 _ 7 as a statement that 35 is 5 times as many as 7 and 7 times as many as 5. Represent verbal statements of multiplicative comparisons as multiplication equations."
CCSS.MATH.CONTENT.4.OA.A.2,MATH.CONTENT,OA,Operations & Algebraic Thinking,4,Grade 4,A2,"Multiply or divide to solve word problems involving multiplicative comparison, e.g., by using drawings and equations with a symbol for the unknown number to represent the problem, distinguishing multiplicative comparison from additive comparison.1"
CCSS.MATH.CONTENT.4.OA.A.3,MATH.CONTENT,OA,Operations & Algebraic Thinking,4,Grade 4,A3,"Solve multistep word problems posed with whole numbers and having whole-number answers using the four operations, including problems in which remainders must be interpreted. Represent these problems using equations with a letter standing for the unknown quantity. Assess the reasonableness of answers using mental computation and estimation strategies including rounding."
CCSS.MATH.CONTENT.4.OA.B.4,MATH.CONTENT,OA,Operations & Algebraic Thinking,4,Grade 4,B4,Find all factor pairs for a whole number in the range 1-100. Recognize that a whole number is a multiple of each of its factors. Determine whether a given whole number in the range 1-100 is a multiple of a given one-digit number. Determine whether a given whole number in the range 1-100 is prime or composite.
CCSS.MATH.CONTENT.4.OA.C.5,MATH.CONTENT,OA,Operations & Algebraic Thinking,4,Grade 4,C5,"Generate a number or shape pattern that follows a given rule. Identify apparent features of the pattern that were not explicit in the rule itself. For example, given the rule ""Add 3"" and the starting number 1, generate terms in the resulting sequence and observe that the terms appear to alternate between odd and even numbers. Explain informally why the numbers will continue to alternate in this way."
CCSS.MATH.CONTENT.5.G.A.1,MATH.CONTENT,G,Geometry,5,Grade 5,A1,"Use a pair of perpendicular number lines, called axes, to define a coordinate system, with the intersection of the lines (the origin) arranged to coincide with the 0 on each line and a given point in the plane located by using an ordered pair of numbers, called its coordinates. Understand that the first number indicates how far to travel from the origin in the direction of one axis, and the second number indicates how far to travel in the direction of the second axis, with the convention that the names of the two axes and the coordinates correspond (e.g., x-axis and x-coordinate, y-axis and y-coordinate)."
CCSS.MATH.CONTENT.5.G.A.2,MATH.CONTENT,G,Geometry,5,Grade 5,A2,"Represent real world and mathematical problems by graphing points in the first quadrant of the coordinate plane, and interpret coordinate values of points in the context of the situation."
CCSS.MATH.CONTENT.5.G.B.3,MATH.CONTENT,G,Geometry,5,Grade 5,B3,"Understand that attributes belonging to a category of two-dimensional figures also belong to all subcategories of that category. For example, all rectangles have four right angles and squares are rectangles, so all squares have four right angles."
CCSS.MATH.CONTENT.5.G.B.4,MATH.CONTENT,G,Geometry,5,Grade 5,B4,Classify two-dimensional figures in a hierarchy based on properties.
CCSS.MATH.CONTENT.5.MD.A.1,MATH.CONTENT,MD,Measurement & Data,5,Grade 5,A1,"Convert among different-sized standard measurement units within a given measurement system (e.g., convert 5 cm to 0.05 m), and use these conversions in solving multi-step, real world problems."
CCSS.MATH.CONTENT.5.MD.B.2,MATH.CONTENT,MD,Measurement & Data,5,Grade 5,B2,"Make a line plot to display a data set of measurements in fractions of a unit (1/2, 1/4, 1/8). Use operations on fractions for this grade to solve problems involving information presented in line plots. For example, given different measurements of liquid in identical beakers, find the amount of liquid each beaker would contain if the total amount in all the beakers were redistributed equally."
CCSS.MATH.CONTENT.5.MD.C.3,MATH.CONTENT,MD,Measurement & Data,5,Grade 5,C3,Recognize volume as an attribute of solid figures and understand concepts of volume measurement.
CCSS.MATH.CONTENT.5.MD.C.3.a,MATH.CONTENT,MD,Measurement & Data,5,Grade 5,C3a,"A cube with side length 1 unit, called a ""unit cube,"" is said to have ""one cubic unit"" of volume, and can be used to measure volume."
CCSS.MATH.CONTENT.5.MD.C.3.b,MATH.CONTENT,MD,Measurement & Data,5,Grade 5,C3b,A solid figure which can be packed without gaps or overlaps using n unit cubes is said to have a volume of n cubic units.
CCSS.MATH.CONTENT.5.MD.C.4,MATH.CONTENT,MD,Measurement & Data,5,Grade 5,C4,"Measure volumes by counting unit cubes, using cubic cm, cubic in, cubic ft, and improvised units."
CCSS.MATH.CONTENT.5.MD.C.5,MATH.CONTENT,MD,Measurement & Data,5,Grade 5,C5,Relate volume to the operations of multiplication and addition and solve real world and mathematical problems involving volume.
CCSS.MATH.CONTENT.5.MD.C.5.a,MATH.CONTENT,MD,Measurement & Data,5,Grade 5,C5a,"Find the volume of a right rectangular prism with whole-number side lengths by packing it with unit cubes, and show that the volume is the same as would be found by multiplying the edge lengths, equivalently by multiplying the height by the area of the base. Represent threefold whole-number products as volumes, e.g., to represent the associative property of multiplication."
CCSS.MATH.CONTENT.5.MD.C.5.b,MATH.CONTENT,MD,Measurement & Data,5,Grade 5,C5b,Apply the formulas V = l × w × h and V = b × h for rectangular prisms to find volumes of right rectangular prisms with whole-number edge lengths in the context of solving real world and mathematical problems.
CCSS.MATH.CONTENT.5.MD.C.5.c,MATH.CONTENT,MD,Measurement & Data,5,Grade 5,C5c,"Recognize volume as additive. Find volumes of solid figures composed of two non-overlapping right rectangular prisms by adding the volumes of the non-overlapping parts, applying this technique to solve real world problems."
CCSS.MATH.CONTENT.5.NBT.A.1,MATH.CONTENT,NBT,Number & Operations in Base Ten,5,Grade 5,A1,"Recognize that in a multi-digit number, a digit in one place represents 10 times as much as it represents in the place to its right and 1/10 of what it represents in the place to its left."
CCSS.MATH.CONTENT.5.NBT.A.2,MATH.CONTENT,NBT,Number & Operations in Base Ten,5,Grade 5,A2,"Explain patterns in the number of zeros of the product when multiplying a number by powers of 10, and explain patterns in the placement of the decimal point when a decimal is multiplied or divided by a power of 10. Use whole-number exponents to denote powers of 10."
CCSS.MATH.CONTENT.5.NBT.A.3,MATH.CONTENT,NBT,Number & Operations in Base Ten,5,Grade 5,A3,"Read, write, and compare decimals to thousandths."
CCSS.MATH.CONTENT.5.NBT.A.3.a,MATH.CONTENT,NBT,Number & Operations in Base Ten,5,Grade 5,A3a,"Read and write decimals to thousandths using base-ten numerals, number names, and expanded form, e.g., 347.392 = 3 × 100 + 4 × 10 + 7 × 1 + 3 × (1/10) + 9 × (1/100) + 2 × (1/1000)."
CCSS.MATH.CONTENT.5.NBT.A.3.b,MATH.CONTENT,NBT,Number & Operations in Base Ten,5,Grade 5,A3b,"Compare two decimals to thousandths based on meanings of the digits in each place, using >, =, and < symbols to record the results of comparisons."
CCSS.MATH.CONTENT.5.NBT.A.4,MATH.CONTENT,NBT,Number & Operations in Base Ten,5,Grade 5,A4,Use place value understanding to round decimals to any place.
CCSS.MATH.CONTENT.5.NBT.B.5,MATH.CONTENT,NBT,Number & Operations in Base Ten,5,Grade 5,B5,Fluently multiply multi-digit whole numbers using the standard algorithm.
CCSS.MATH.CONTENT.5.NBT.B.6,MATH.CONTENT,NBT,Number & Operations in Base Ten,5,Grade 5,B6,"Find whole-number quotients of whole numbers with up to four-digit dividends and two-digit divisors, using strategies based on place value, the properties of operations, and/or the relationship between multiplication and division. Illustrate and explain the calculation by using equations, rectangular arrays, and/or area models."
CCSS.MATH.CONTENT.5.NBT.B.7,MATH.CONTENT,NBT,Number & Operations in Base Ten,5,Grade 5,B7,"Add, subtract, multiply, and divide decimals to hundredths, using concrete models or drawings and strategies based on place value, properties of operations, and/or the relationship between addition and subtraction; relate the strategy to a written method and explain the reasoning used."
CCSS.MATH.CONTENT.5.NF.A.1,MATH.CONTENT,NF,Numbers & Operations - Fractions,5,Grade 5,A1,"Add and subtract fractions with unlike denominators (including mixed numbers) by replacing given fractions with equivalent fractions in such a way as to produce an equivalent sum or difference of fractions with like denominators. For example, 2/3 + 5/4 = 8/12 + 15/12 = 23/12. (In general, a/b + c/d = (ad + bc)/bd.)"
CCSS.MATH.CONTENT.5.NF.A.2,MATH.CONTENT,NF,Numbers & Operations - Fractions,5,Grade 5,A2,"Solve word problems involving addition and subtraction of fractions referring to the same whole, including cases of unlike denominators, e.g., by using visual fraction models or equations to represent the problem. Use benchmark fractions and number sense of fractions to estimate mentally and assess the reasonableness of answers. For example, recognize an incorrect result 2/5 + 1/2 = 3/7, by observing that 3/7 < 1/2."
CCSS.MATH.CONTENT.5.NF.B.3,MATH.CONTENT,NF,Numbers & Operations - Fractions,5,Grade 5,B3,"Interpret a fraction as division of the numerator by the denominator (a/b = a ÷ b). Solve word problems involving division of whole numbers leading to answers in the form of fractions or mixed numbers, e.g., by using visual fraction models or equations to represent the problem. For example, interpret 3/4 as the result of dividing 3 by 4, noting that 3/4 multiplied by 4 equals 3, and that when 3 wholes are shared equally among 4 people each person has a share of size 3/4. If 9 people want to share a 50-pound sack of rice equally by weight, how many pounds of rice should each person get? Between what two whole numbers does your answer lie?"
CCSS.MATH.CONTENT.5.NF.B.4,MATH.CONTENT,NF,Numbers & Operations - Fractions,5,Grade 5,B4,Apply and extend previous understandings of multiplication to multiply a fraction or whole number by a fraction.
CCSS.MATH.CONTENT.5.NF.B.4.a,MATH.CONTENT,NF,Numbers & Operations - Fractions,5,Grade 5,B4a,"Interpret the product (a/b) × q as a parts of a partition of q into b equal parts; equivalently, as the result of a sequence of operations a × q ÷ b. For example, use a visual fraction model to show (2/3) × 4 = 8/3, and create a story context for this equation. Do the same with (2/3) × (4/5) = 8/15. (In general, (a/b) × (c/d) = ac/bd.)"
CCSS.MATH.CONTENT.5.NF.B.4.b,MATH.CONTENT,NF,Numbers & Operations - Fractions,5,Grade 5,B4b,"Find the area of a rectangle with fractional side lengths by tiling it with unit squares of the appropriate unit fraction side lengths, and show that the area is the same as would be found by multiplying the side lengths. Multiply fractional side lengths to find areas of rectangles, and represent fraction products as rectangular areas."
CCSS.MATH.CONTENT.5.NF.B.5,MATH.CONTENT,NF,Numbers & Operations - Fractions,5,Grade 5,B5,"Interpret multiplication as scaling (resizing), by:"
CCSS.MATH.CONTENT.5.NF.B.5.a,MATH.CONTENT,NF,Numbers & Operations - Fractions,5,Grade 5,B5a,"Comparing the size of a product to the size of one factor on the basis of the size of the other factor, without performing the indicated multiplication."
CCSS.MATH.CONTENT.5.NF.B.5.b,MATH.CONTENT,NF,Numbers & Operations - Fractions,5,Grade 5,B5b,Explaining why multiplying a given number by a fraction greater than 1 results in a product greater than the given number (recognizing multiplication by whole numbers greater than 1 as a familiar case); explaining why multiplying a given number by a fraction less than 1 results in a product smaller than the given number; and relating the principle of fraction equivalence a/b = (n × a)/(n × b) to the effect of multiplying a/b by 1.
CCSS.MATH.CONTENT.5.NF.B.6,MATH.CONTENT,NF,Numbers & Operations - Fractions,5,Grade 5,B6,"Solve real world problems involving multiplication of fractions and mixed numbers, e.g., by using visual fraction models or equations to represent the problem."
CCSS.MATH.CONTENT.5.NF.B.7,MATH.CONTENT,NF,Numbers & Operations - Fractions,5,Grade 5,B7,Apply and extend previous understandings of division to divide unit fractions by whole numbers and whole numbers by unit fractions.1
CCSS.MATH.CONTENT.5.NF.B.7.a,MATH.CONTENT,NF,Numbers & Operations - Fractions,5,Grade 5,B7a,"Interpret division of a unit fraction by a non-zero whole number, and compute such quotients. For example, create a story context for (1/3) ÷ 4, and use a visual fraction model to show the quotient. Use the relationship between multiplication and division to explain that (1/3) ÷ 4 = 1/12 because (1/12) × 4 = 1/3."
