id,content_type,category_id,category_name,grade_id,grade_name,item,description
CCSS.ELA-LITERACY.WHST.9-10.1.a,ELA-LITERACY,WHST,"Writing: History, Science & Technical Subjects",9-10,Grade 9-10,1a,"Introduce precise claim(s), distinguish the claim(s) from alternate or opposing claims, and create an organization that establishes clear relationships among the claim(s), counterclaims, reasons, and evidence."
CCSS.ELA-LITERACY.WHST.9-10.1.b,ELA-LITERACY,WHST,"Writing: History, Science & Technical Subjects",9-10,Grade 9-10,1b,"Develop claim(s) and counterclaims fairly, supplying data and evidence for each while pointing out the strengths and limitations of both claim(s) and counterclaims in a discipline-appropriate form and in a manner that anticipates the audience's knowledge level and concerns."
CCSS.ELA-LITERACY.WHST.9-10.1.c,ELA-LITERACY,WHST,"Writing: History, Science & Technical Subjects",9-10,Grade 9-10,1c,"Use words, phrases, and clauses to link the major sections of the text, create cohesion, and clarify the relationships between claim(s) and reasons, between reasons and evidence, and between claim(s) and counterclaims."
CCSS.ELA-LITERACY.WHST.9-10.1.d,ELA-LITERACY,WHST,"Writing: History, Science & Technical Subjects",9-10,Grade 9-10,1d,Establish and maintain a formal style and objective tone while attending to the norms and conventions of the discipline in which they are writing.
CCSS.ELA-LITERACY.WHST.9-10.1.e,ELA-LITERACY,WHST,"Writing: History, Science & Technical Subjects",9-10,Grade 9-10,1e,Provide a concluding statement or section that follows from or supports the argument presented.
CCSS.ELA-LITERACY.WHST.9-10.2,ELA-LITERACY,WHST,"Writing: History, Science & Technical Subjects",9-10,Grade 9-10,2,"Write informative/explanatory texts, including the narration of historical events, scientific procedures/ experiments, or technical processes."
CCSS.ELA-LITERACY.WHST.9-10.2.a,ELA-LITERACY,WHST,"Writing: History, Science & Technical Subjects",9-10,Grade 9-10,2a,"Introduce a topic and organize ideas, concepts, and information to make important connections and distinctions; include formatting (e.g., headings), graphics (e.g., figures, tables), and multimedia when useful to aiding comprehension."
CCSS.ELA-LITERACY.WHST.9-10.2.b,ELA-LITERACY,WHST,"Writing: History, Science & Technical Subjects",9-10,Grade 9-10,2b,"Develop the topic with well-chosen, relevant, and sufficient facts, extended definitions, concrete details, quotations, or other information and examples appropriate to the audience's knowledge of the topic."
CCSS.ELA-LITERACY.WHST.9-10.2.c,ELA-LITERACY,WHST,"Writing: History, Science & Technical Subjects",9-10,Grade 9-10,2c,"Use varied transitions and sentence structures to link the major sections of the text, create cohesion, and clarify the relationships among ideas and concepts."
CCSS.ELA-LITERACY.WHST.9-10.2.d,ELA-LITERACY,WHST,"Writing: History, Science & Technical Subjects",9-10,Grade 9-10,2d,Use precise language and domain-specific vocabulary to manage the complexity of the topic and convey a style appropriate to the discipline and context as well as to the expertise of likely readers.
CCSS.ELA-LITERACY.WHST.9-10.2.e,ELA-LITERACY,WHST,"Writing: History, Science & Technical Subjects",9-10,Grade 9-10,2e,Establish and maintain a formal style and objective tone while attending to the norms and conventions of the discipline in which they are writing.
CCSS.ELA-LITERACY.WHST.9-10.2.f,ELA-LITERACY,WHST,"Writing: History, Science & Technical Subjects",9-10,Grade 9-10,2f,"Provide a concluding statement or section that follows from and supports the information or explanation presented (e.g., articulating implications or the significance of the topic)."
CCSS.ELA-LITERACY.WHST.9-10.3,ELA-LITERACY,WHST,"Writing: History, Science & Technical Subjects",9-10,Grade 9-10,3,(See note; not applicable as a separate requirement)
CCSS.ELA-LITERACY.WHST.9-10.4,ELA-LITERACY,WHST,"Writing: History, Science & Technical Subjects",9-10,Grade 9-10,4,"Produce clear and coherent writing in which the development, organization, and style are appropriate to task, purpose, and audience."
CCSS.ELA-LITERACY.WHST.9-10.5,ELA-LITERACY,WHST,"Writing: History, Science & Technical Subjects",9-10,Grade 9-10,5,"Develop and strengthen writing as needed by planning, revising, editing, rewriting, or trying a new approach, focusing on addressing what is most significant for a specific purpose and audience."
CCSS.ELA-LITERACY.WHST.9-10.6,ELA-LITERACY,WHST,"Writing: History, Science & Technical Subjects",9-10,Grade 9-10,6,"Use technology, including the Internet, to produce, publish, and update individual or shared writing products, taking advantage of technology's capacity to link to other information and to display information flexibly and dynamically."
CCSS.ELA-LITERACY.WHST.9-10.7,ELA-LITERACY,WHST,"Writing: History, Science & Technical Subjects",9-10,Grade 9-10,7,"Conduct short as well as more sustained research projects to answer a question (including a self-generated question) or solve a problem; narrow or broaden the inquiry when appropriate; synthesize multiple sources on the subject, demonstrating understanding of the subject under investigation."
CCSS.ELA-LITERACY.WHST.9-10.8,ELA-LITERACY,WHST,"Writing: History, Science & Technical Subjects",9-10,Grade 9-10,8,"Gather relevant information from multiple authoritative print and digital sources, using advanced searches effectively; assess the usefulness of each source in answering the research question; integrate information into the text selectively to maintain the flow of ideas, avoiding plagiarism and following a standard format for citation."
CCSS.ELA-LITERACY.WHST.9-10.9,ELA-LITERACY,WHST,"Writing: History, Science & Technical Subjects",9-10,Grade 9-10,9,"Draw evidence from informational texts to support analysis, reflection, and research."
CCSS.ELA-LITERACY.WHST.9-10.10,ELA-LITERACY,WHST,"Writing: History, Science & Technical Subjects",9-10,Grade 9-10,10,"Write routinely over extended time frames (time for reflection and revision) and shorter time frames (a single sitting or a day or two) for a range of discipline-specific tasks, purposes, and audiences."
CCSS.ELA-LITERACY.L.11-12.1,ELA-LITERACY,L,Language,11-12,Grade 11-12,1,Demonstrate command of the conventions of standard English grammar and usage when writing or speaking.
CCSS.ELA-LITERACY.L.11-12.1.a,ELA-LITERACY,L,Language,11-12,Grade 11-12,1a,"Apply the understanding that usage is a matter of convention, can change over time, and is sometimes contested."
CCSS.ELA-LITERACY.L.11-12.1.b,ELA-LITERACY,L,Language,11-12,Grade 11-12,1b,"Resolve issues of complex or contested usage, consulting references (e.g., Merriam-Webster's Dictionary of English Usage, Garner's Modern American Usage) as needed."
CCSS.ELA-LITERACY.L.11-12.2,ELA-LITERACY,L,Language,11-12,Grade 11-12,2,"Demonstrate command of the conventions of standard English capitalization, punctuation, and spelling when writing."
CCSS.ELA-LITERACY.L.11-12.2.a,ELA-LITERACY,L,Language,11-12,Grade 11-12,2a,Observe hyphenation conventions.
CCSS.ELA-LITERACY.L.11-12.2.b,ELA-LITERACY,L,Language,11-12,Grade 11-12,2b,Spell correctly.
CCSS.ELA-LITERACY.L.11-12.3,ELA-LITERACY,L,Language,11-12,Grade 11-12,3,"Apply knowledge of language to understand how language functions in different contexts, to make effective choices for meaning or style, and to comprehend more fully when reading or listening."
CCSS.ELA-LITERACY.L.11-12.3.a,ELA-LITERACY,L,Language,11-12,Grade 11-12,3a,"Vary syntax for effect, consulting references (e.g., Tufte's Artful Sentences) for guidance as needed; apply an understanding of syntax to the study of complex texts when reading."
CCSS.ELA-LITERACY.L.11-12.4,ELA-LITERACY,L,Language,11-12,Grade 11-12,4,"Determine or clarify the meaning of unknown and multiple-meaning words and phrases based on grades 11-12 reading and content, choosing flexibly from a range of strategies."
CCSS.ELA-LITERACY.L.11-12.4.a,ELA-LITERACY,L,Language,11-12,Grade 11-12,4a,"Use context (e.g., the overall meaning of a sentence, paragraph, or text; a word's position or function in a sentence) as a clue to the meaning of a word or phrase."
CCSS.ELA-LITERACY.L.11-12.4.b,ELA-LITERACY,L,Language,11-12,Grade 11-12,4b,"Identify and correctly use patterns of word changes that indicate different meanings or parts of speech (e.g., conceive, conception, conceivable)."
CCSS.ELA-LITERACY.L.11-12.4.c,ELA-LITERACY,L,Language,11-12,Grade 11-12,4c,"Consult general and specialized reference materials (e.g., dictionaries, glossaries, thesauruses), both print and digital, to find the pronunciation of a word or determine or clarify its precise meaning, its part of speech, its etymology, or its standard usage."
CCSS.ELA-LITERACY.L.11-12.4.d,ELA-LITERACY,L,Language,11-12,Grade 11-12,4d,"Verify the preliminary determination of the meaning of a word or phrase (e.g., by checking the inferred meaning in context or in a dictionary)."
CCSS.ELA-LITERACY.L.11-12.5,ELA-LITERACY,L,Language,11-12,Grade 11-12,5,"Demonstrate understanding of figurative language, word relationships, and nuances in word meanings."
CCSS.ELA-LITERACY.L.11-12.5.a,ELA-LITERACY,L,Language,11-12,Grade 11-12,5a,"Interpret figures of speech (e.g., hyperbole, paradox) in context and analyze their role in the text."
CCSS.ELA-LITERACY.L.11-12.5.b,ELA-LITERACY,L,Language,11-12,Grade 11-12,5b,Analyze nuances in the meaning of words with similar denotations.
CCSS.ELA-LITERACY.L.11-12.6,ELA-LITERACY,L,Language,11-12,Grade 11-12,6,"Acquire and use accurately general academic and domain-specific words and phrases, sufficient for reading, writing, speaking, and listening at the college and career readiness level; demonstrate independence in gathering vocabulary knowledge when considering a word or phrase important to comprehension or expression."
CCSS.ELA-LITERACY.RH.11-12.1,ELA-LITERACY,RH,History/Social Studies,11-12,Grade 11-12,1,"Cite specific textual evidence to support analysis of primary and secondary sources, connecting insights gained from specific details to an understanding of the text as a whole."
CCSS.ELA-LITERACY.RH.11-12.2,ELA-LITERACY,RH,History/Social Studies,11-12,Grade 11-12,2,Determine the central ideas or information of a primary or secondary source; provide an accurate summary that makes clear the relationships among the key details and ideas.
CCSS.ELA-LITERACY.RH.11-12.3,ELA-LITERACY,RH,History/Social Studies,11-12,Grade 11-12,3,"Evaluate various explanations for actions or events and determine which explanation best accords with textual evidence, acknowledging where the text leaves matters uncertain."
CCSS.ELA-LITERACY.RH.11-12.4,ELA-LITERACY,RH,History/Social Studies,11-12,Grade 11-12,4,"Determine the meaning of words and phrases as they are used in a text, including analyzing how an author uses and refines the meaning of a key term over the course of a text (e.g., how Madison defines faction in Federalist No. 10)."
CCSS.ELA-LITERACY.RH.11-12.5,ELA-LITERACY,RH,History/Social Studies,11-12,Grade 11-12,5,"Analyze in detail how a complex primary source is structured, including how key sentences, paragraphs, and larger portions of the text contribute to the whole."
CCSS.ELA-LITERACY.RH.11-12.6,ELA-LITERACY,RH,History/Social Studies,11-12,Grade 11-12,6,"Evaluate authors' differing points of view on the same historical event or issue by assessing the authors' claims, reasoning, and evidence."
CCSS.ELA-LITERACY.RH.11-12.7,ELA-LITERACY,RH,History/Social Studies,11-12,Grade 11-12,7,"Integrate and evaluate multiple sources of information presented in diverse formats and media (e.g., visually, quantitatively, as well as in words) in order to address a question or solve a problem."
CCSS.ELA-LITERACY.RH.11-12.8,ELA-LITERACY,RH,History/Social Studies,11-12,Grade 11-12,8,"Evaluate an author's premises, claims, and evidence by corroborating or challenging them with other information."
CCSS.ELA-LITERACY.RH.11-12.9,ELA-LITERACY,RH,History/Social Studies,11-12,Grade 11-12,9,"Integrate information from diverse sources, both primary and secondary, into a coherent understanding of an idea or event, noting discrepancies among sources."
CCSS.ELA-LITERACY.RH.11-12.10,ELA-LITERACY,RH,History/Social Studies,11-12,Grade 11-12,10,"By the end of grade 12, read and comprehend history/social studies texts in the grades 11-CCR text complexity band independently and proficiently."
CCSS.ELA-LITERACY.RI.11-12.1,ELA-LITERACY,RI,Reading: Informational Text,11-12,Grade 11-12,1,"Cite strong and thorough textual evidence to support analysis of what the text says explicitly as well as inferences drawn from the text, including determining where the text leaves matters uncertain."
CCSS.ELA-LITERACY.RI.11-12.2,ELA-LITERACY,RI,Reading: Informational Text,11-12,Grade 11-12,2,"Determine two or more central ideas of a text and analyze their development over the course of the text, including how they interact and build on one another to provide a complex analysis; provide an objective summary of the text."
CCSS.ELA-LITERACY.RI.11-12.3,ELA-LITERACY,RI,Reading: Informational Text,11-12,Grade 11-12,3,"Analyze a complex set of ideas or sequence of events and explain how specific individuals, ideas, or events interact and develop over the course of the text."
CCSS.ELA-LITERACY.RI.11-12.4,ELA-LITERACY,RI,Reading: Informational Text,11-12,Grade 11-12,4,"Determine the meaning of words and phrases as they are used in a text, including figurative, connotative, and technical meanings; analyze how an author uses and refines the meaning of a key term or terms over the course of a text (e.g., how Madison defines faction in Federalist No. 10)."
CCSS.ELA-LITERACY.RI.11-12.5,ELA-LITERACY,RI,Reading: Informational Text,11-12,Grade 11-12,5,"Analyze and evaluate the effectiveness of the structure an author uses in his or her exposition or argument, including whether the structure makes points clear, convincing, and engaging."
CCSS.ELA-LITERACY.RI.11-12.6,ELA-LITERACY,RI,Reading: Informational Text,11-12,Grade 11-12,6,"Determine an author's point of view or purpose in a text in which the rhetoric is particularly effective, analyzing how style and content contribute to the power, persuasiveness or beauty of the text."
CCSS.ELA-LITERACY.RI.11-12.7,ELA-LITERACY,RI,Reading: Informational Text,11-12,Grade 11-12,7,"Integrate and evaluate multiple sources of information presented in different media or formats (e.g., visually, quantitatively) as well as in words in order to address a question or solve a problem."
CCSS.ELA-LITERACY.RI.11-12.8,ELA-LITERACY,RI,Reading: Informational Text,11-12,Grade 11-12,8,"Delineate and evaluate the reasoning in seminal U.S. texts, including the application of constitutional principles and use of legal reasoning (e.g., in U.S. Supreme Court majority opinions and dissents) and the premises, purposes, and arguments in works of public advocacy (e.g., The Federalist, presidential addresses)."
CCSS.ELA-LITERACY.RI.11-12.9,ELA-LITERACY,RI,Reading: Informational Text,11-12,Grade 11-12,9,"Analyze seventeenth, eighteenth, and nineteenth-century foundational U.S. documents of historical and literary significance (including The Declaration of Independence, the Preamble to the Constitution, the Bill of Rights, and Lincoln's Second Inaugural Address) for their themes, purposes, and rhetorical features."
CCSS.ELA-LITERACY.RI.11-12.10,ELA-LITERACY,RI,Reading: Informational Text,11-12,Grade 11-12,10,"By the end of grade 11, read and comprehend literary nonfiction in the grades 11-CCR text complexity band proficiently, with scaffolding as needed at the high end of the range. By the end of grade 12, read and comprehend literary nonfiction at the high end of the grades 11-CCR text complexity band independently and proficiently."
CCSS.ELA-LITERACY.RL.11-12.1,ELA-LITERACY,RL,Reading: Literature,11-12,Grade 11-12,1,"Cite strong and thorough textual evidence to support analysis of what the text says explicitly as well as inferences drawn from the text, including determining where the text leaves matters uncertain."
CCSS.ELA-LITERACY.RL.11-12.2,ELA-LITERACY,RL,Reading: Literature,11-12,Grade 11-12,2,"Determine two or more themes or central ideas of a text and analyze their development over the course of the text, including how they interact and build on one another to produce a complex account; provide an objective summary of the text."
CCSS.ELA-LITERACY.RL.11-12.3,ELA-LITERACY,RL,Reading: Literature,11-12,Grade 11-12,3,"Analyze the impact of the author's choices regarding how to develop and relate elements of a story or drama (e.g., where a story is set, how the action is ordered, how the characters are introduced and developed)."
CCSS.ELA-LITERACY.RL.11-12.4,ELA-LITERACY,RL,Reading: Literature,11-12,Grade 11-12,4,"Determine the meaning of words and phrases as they are used in the text, including figurative and connotative meanings; analyze the impact of specific word choices on meaning and tone, including words with multiple meanings or language that is particularly fresh, engaging, or beautiful. (Include Shakespeare as well as other authors.)"
CCSS.ELA-LITERACY.RL.11-12.5,ELA-LITERACY,RL,Reading: Literature,11-12,Grade 11-12,5,"Analyze how an author's choices concerning how to structure specific parts of a text (e.g., the choice of where to begin or end a story, the choice to provide a comedic or tragic resolution) contribute to its overall structure and meaning as well as its aesthetic impact."
CCSS.ELA-LITERACY.RL.11-12.6,ELA-LITERACY,RL,Reading: Literature,11-12,Grade 11-12,6,"Analyze a case in which grasping a point of view requires distinguishing what is directly stated in a text from what is really meant (e.g., satire, sarcasm, irony, or understatement)."
CCSS.ELA-LITERACY.RL.11-12.7,ELA-LITERACY,RL,Reading: Literature,11-12,Grade 11-12,7,"Analyze multiple interpretations of a story, drama, or poem (e.g., recorded or live production of a play or recorded novel or poetry), evaluating how each version interprets the source text. (Include at least one play by Shakespeare and one play by an American dramatist.)"
CCSS.ELA-LITERACY.RL.11-12.8,ELA-LITERACY,RL,Reading: Literature,11-12,Grade 11-12,8,(RL.11-12.8 not applicable to literature)
CCSS.ELA-LITERACY.RL.11-12.9,ELA-LITERACY,RL,Reading: Literature,11-12,Grade 11-12,9,"Demonstrate knowledge of eighteenth, nineteenth- and early-twentieth-century foundational works of American literature, including how two or more texts from the same period treat similar themes or topics."
CCSS.ELA-LITERACY.RL.11-12.10,ELA-LITERACY,RL,Reading: Literature,11-12,Grade 11-12,10,"By the end of grade 11, read and comprehend literature, including stories, dramas, and poems, in the grades 11-CCR text complexity band proficiently, with scaffolding as needed at the high end of the range.  By the end of grade 12, read and comprehend literature, including stories, dramas, and poems, at the high end of the grades 11-CCR text complexity band independently and proficiently."
CCSS.ELA-LITERACY.RST.11-12.1,ELA-LITERACY,RST,Science & Technical Subjects,11-12,Grade 11-12,1,"Cite specific textual evidence to support analysis of science and technical texts, attending to important distinctions the author makes and to any gaps or inconsistencies in the account."
CCSS.ELA-LITERACY.RST.11-12.2,ELA-LITERACY,RST,Science & Technical Subjects,11-12,Grade 11-12,2,"Determine the central ideas or conclusions of a text; summarize complex concepts, processes, or information presented in a text by paraphrasing them in simpler but still accurate terms."
CCSS.ELA-LITERACY.RST.11-12.3,ELA-LITERACY,RST,Science & Technical Subjects,11-12,Grade 11-12,3,"Follow precisely a complex multistep procedure when carrying out experiments, taking measurements, or performing technical tasks; analyze the specific results based on explanations in the text."
CCSS.ELA-LITERACY.RST.11-12.4,ELA-LITERACY,RST,Science & Technical Subjects,11-12,Grade 11-12,4,"Determine the meaning of symbols, key terms, and other domain-specific words and phrases as they are used in a specific scientific or technical context relevant to grades 11-12 texts and topics."
CCSS.ELA-LITERACY.RST.11-12.5,ELA-LITERACY,RST,Science & Technical Subjects,11-12,Grade 11-12,5,"Analyze how the text structures information or ideas into categories or hierarchies, demonstrating understanding of the information or ideas."
CCSS.ELA-LITERACY.RST.11-12.6,ELA-LITERACY,RST,Science & Technical Subjects,11-12,Grade 11-12,6,"Analyze the author's purpose in providing an explanation, describing a procedure, or discussing an experiment in a text, identifying important issues that remain unresolved."
CCSS.ELA-LITERACY.RST.11-12.7,ELA-LITERACY,RST,Science & Technical Subjects,11-12,Grade 11-12,7,"Integrate and evaluate multiple sources of information presented in diverse formats and media (e.g., quantitative data, video, multimedia) in order to address a question or solve a problem."
CCSS.ELA-LITERACY.RST.11-12.8,ELA-LITERACY,RST,Science & Technical Subjects,11-12,Grade 11-12,8,"Evaluate the hypotheses, data, analysis, and conclusions in a science or technical text, verifying the data when possible and corroborating or challenging conclusions with other sources of information."
CCSS.ELA-LITERACY.RST.11-12.9,ELA-LITERACY,RST,Science & Technical Subjects,11-12,Grade 11-12,9,"Synthesize information from a range of sources (e.g., texts, experiments, simulations) into a coherent understanding of a process, phenomenon, or concept, resolving conflicting information when possible."
CCSS.ELA-LITERACY.RST.11-12.10,ELA-LITERACY,RST,Science & Technical Subjects,11-12,Grade 11-12,10,"By the end of grade 12, read and comprehend science/technical texts in the grades 11-CCR text complexity band independently and proficiently."
CCSS.ELA-LITERACY.SL.11-12.1,ELA-LITERACY,SL,Speaking & Listening,11-12,Grade 11-12,1,"Initiate and participate effectively in a range of collaborative discussions (one-on-one, in groups, and teacher-led) with diverse partners on grades 11-12 topics, texts, and issues, building on others' ideas and expressing their own clearly and persuasively."
CCSS.ELA-LITERACY.SL.11-12.1.a,ELA-LITERACY,SL,Speaking & Listening,11-12,Grade 11-12,1a,"Come to discussions prepared, having read and researched material under study; explicitly draw on that preparation by referring to evidence from texts and other research on the topic or issue to stimulate a thoughtful, well-reasoned exchange of ideas."
CCSS.ELA-LITERACY.SL.11-12.1.b,ELA-LITERACY,SL,Speaking & Listening,11-12,Grade 11-12,1b,"Work with peers to promote civil, democratic discussions and decision-making, set clear goals and deadlines, and establish individual roles as needed."
CCSS.ELA-LITERACY.SL.11-12.1.c,ELA-LITERACY,SL,Speaking & Listening,11-12,Grade 11-12,1c,"Propel conversations by posing and responding to questions that probe reasoning and evidence; ensure a hearing for a full range of positions on a topic or issue; clarify, verify, or challenge ideas and conclusions; and promote divergent and creative perspectives."
CCSS.ELA-LITERACY.SL.11-12.1.d,ELA-LITERACY,SL,Speaking & Listening,11-12,Grade 11-12,1d,"Respond thoughtfully to diverse perspectives; synthesize comments, claims, and evidence made on all sides of an issue; resolve contradictions when possible; and determine what additional information or research is required to deepen the investigation or complete the task."
CCSS.ELA-LITERACY.SL.11-12.2,ELA-LITERACY,SL,Speaking & Listening,11-12,Grade 11-12,2,"Integrate multiple sources of information presented in diverse formats and media (e.g., visually, quantitatively, orally) in order to make informed decisions and solve problems, evaluating the credibility and accuracy of each source and noting any discrepancies among the data."
CCSS.ELA-LITERACY.SL.11-12.3,ELA-LITERACY,SL,Speaking & Listening,11-12,Grade 11-12,3,"Evaluate a speaker's point of view, reasoning, and use of evidence and rhetoric, assessing the stance, premises, links among ideas, word choice, points of emphasis, and tone used."
CCSS.ELA-LITERACY.SL.11-12.4,ELA-LITERACY,SL,Speaking & Listening,11-12,Grade 11-12,4,"Present information, findings, and supporting evidence, conveying a clear and distinct perspective, such that listeners can follow the line of reasoning, alternative or opposing perspectives are addressed, and the organization, development, substance, and style are appropriate to purpose, audience, and a range of formal and informal tasks."
CCSS.ELA-LITERACY.SL.11-12.5,ELA-LITERACY,SL,Speaking & Listening,11-12,Grade 11-12,5,"Make strategic use of digital media (e.g., textual, graphical, audio, visual, and interactive elements) in presentations to enhance understanding of findings, reasoning, and evidence and to add interest."
CCSS.ELA-LITERACY.SL.11-12.6,ELA-LITERACY,SL,Speaking & Listening,11-12,Grade 11-12,6,"Adapt speech to a variety of contexts and tasks, demonstrating a command of formal English when indicated or appropriate. (See grades 11-12 Language standards 1 and 3 here for specific expectations.)"
CCSS.ELA-LITERACY.W.11-12.1,ELA-LITERACY,W,Writing,11-12,Grade 11-12,1,"Write arguments to support claims in an analysis of substantive topics or texts, using valid reasoning and relevant and sufficient evidence."
CCSS.ELA-LITERACY.W.11-12.1.a,ELA-LITERACY,W,Writing,11-12,Grade 11-12,1a,"Introduce precise, knowledgeable claim(s), establish the significance of the claim(s), distinguish the claim(s) from alternate or opposing claims, and create an organization that logically sequences claim(s), counterclaims, reasons, and evidence."
